<?xml version="1.0" encoding="UTF-8" standalone="no"?>
 <!DOCTYPE dossiermidecaux SYSTEM "./dosiermedicaux.dtd"> 
<dossiermidecaux >
    <!-- dans cette balise <listemedecin> on definit tout les medecin qui ont traitee un dossier medical et ont leur attribue un ID pour on puisse les réferencier dans le documment -->
    <listemedecin>

        <medecin idm="m_1" sexe="homme">
            <informationpersonnel>
                <nom>Belkaid</nom>
                <prenom>Sofiane</prenom>
                <img src="src//doc1.jpg"/>

                <datedenaissance>
                    <jour>17</jour>
                    <mois>01</mois>
                    <annee>1990</annee>
                </datedenaissance>

                <email type="personel">belsofiane17@gmail.com</email>

                <adresse type="privee">
                    <pays>algerie</pays>
                    <wilaya>oran</wilaya>
                    <localitee>M9V5+VGC, Boulevard Doctor Benzerdjeb, Oran</localitee>
                </adresse>

            </informationpersonnel>

            <informationprofesionnel>
                <specialite>Cardiologie</specialite>
                <numero categorie="mobile">0660917888</numero>
                <lieuxdetravaille>
                    <lieux type="cabinet">
                        <nom>cabinet medicale de dr belkaid</nom>
                        <adresse type="travaille">
                            <pays>algerie</pays>
                            <wilaya>oran</wilaya>
                            <localitee>5 Place des Victoires, Oran 31000</localitee>
                        </adresse>
                    </lieux>
                    <lieux type="etablissementdesante">
                        <nom>clinique medicale de maternitee </nom>
                        <adresse type="travaille">
                            <pays>algerie</pays>
                            <wilaya>oran</wilaya>
                            <localitee>74 Boulevard centre ville, Oran 31000</localitee>
                        </adresse>
                    </lieux>
                </lieuxdetravaille>
            </informationprofesionnel>
        </medecin>

        <medecin idm="m_2" sexe="homme">
            <informationpersonnel>
                <nom>senhadji</nom>
                <prenom>amine</prenom>
                <img src="src//doc2.jpg"/>

                <datedenaissance>
                    <jour>25</jour>
                    <mois>04</mois>
                    <annee>1969</annee>
                </datedenaissance>

                <email type="personel">senham25@gmail.com</email>

                <adresse type="privee">
                    <pays>algerie</pays>
                    <wilaya>oran</wilaya>
                    <localitee>M9V5+VGC, Residence hasnaoui, Oran</localitee>
                </adresse>

            </informationpersonnel>

            <informationprofesionnel>
                <specialite>Ophtalmologie</specialite>
                <numero categorie="mobile">0560917890</numero>
                <lieuxdetravaille>
                    <lieux type="cabinet">
                        <nom>cabinet medicale de dr senhadji</nom>
                        <adresse type="travaille">
                            <pays>algerie</pays>
                            <wilaya>oran</wilaya>
                            <localitee>5 Place des Victoires, Oran 31000</localitee>
                        </adresse>
                    </lieux>
                    <lieux type="etablissementdesante">
                        <nom>clinique medicale </nom>
                        <adresse type="travaille">
                            <pays>algerie</pays>
                            <wilaya>oran</wilaya>
                            <localitee>74 Boulevard Doctor Benzerdjeb, Oran 31000</localitee>
                        </adresse>
                    </lieux>
                </lieuxdetravaille>
            </informationprofesionnel>
        </medecin>

        <medecin idm="m_3" sexe="homme">
            <informationpersonnel>
                <nom>hamedi</nom>
                <prenom>ahmed</prenom>
                <img src="src//doc3.jpg"/>

                <datedenaissance>
                    <jour>20</jour>
                    <mois>08</mois>
                    <annee>1970</annee>
                </datedenaissance>

                <email type="personel">hamediah17@gmail.com</email>

                <adresse type="privee">
                    <pays>algerie</pays>
                    <wilaya>oran</wilaya>
                    <localitee>M9V5+VGC, Boulevard Doctor Benzerdjeb, Oran</localitee>
                </adresse>

            </informationpersonnel>

            <informationprofesionnel>
                <specialite>Oncologie</specialite>
                <numero categorie="mobile">0760917800</numero>
                <lieuxdetravaille>
                    <lieux type="cabinet">
                        <nom>cabinet medicale de dr hamedi</nom>
                        <adresse type="travaille">
                            <pays>algerie</pays>
                            <wilaya>oran</wilaya>
                            <localitee>5 Place des Victoires, Oran 31000</localitee>
                        </adresse>
                    </lieux>
                    <lieux type="etablissementdesante">
                        <nom>clinique medicale</nom>
                        <adresse type="travaille">
                            <pays>algerie</pays>
                            <wilaya>oran</wilaya>
                            <localitee>74 Boulevard Doctor Benzerdjeb, Oran 31000</localitee>
                        </adresse>
                    </lieux>
                </lieuxdetravaille>
            </informationprofesionnel>
        </medecin>
        
        <medecin idm="m_4" sexe="homme">
            <informationpersonnel>
                <nom>zemouri</nom>
                <prenom>marwane</prenom>
                <img src="src//doc4.jpg"/>

                <datedenaissance>
                    <jour>18</jour>
                    <mois>07</mois>
                    <annee>1980</annee>
                </datedenaissance>

                <email type="personel">zmmarwane18@gmail.com</email>

                <adresse type="privee">
                    <pays>algerie</pays>
                    <wilaya>oran</wilaya>
                    <localitee>M9V5+VGC, Senia, Oran</localitee>
                </adresse>

            </informationpersonnel>

            <informationprofesionnel>
                <specialite>Oncologie</specialite>
                <numero categorie="mobile">0790817700</numero>
                <lieuxdetravaille>
                    <lieux type="cabinet">
                        <nom>cabinet medicale de dr hamedi</nom>
                        <adresse type="travaille">
                            <pays>algerie</pays>
                            <wilaya>oran</wilaya>
                            <localitee>5 Place des Victoires, Oran 31000</localitee>
                        </adresse>
                    </lieux>
                    <lieux type="etablissementdesante">
                        <nom>clinique medicale</nom>
                        <adresse type="travaille">
                            <pays>algerie</pays>
                            <wilaya>oran</wilaya>
                            <localitee>74 Boulevard Doctor Benzerdjeb, Oran 31000</localitee>
                        </adresse>
                    </lieux>
                </lieuxdetravaille>
            </informationprofesionnel>
        </medecin>
        
        <medecin idm="m_5" sexe="femme">
            <informationpersonnel>
                <nom>Melianni</nom>
                <prenom>Oumayma</prenom>
                <img src="src//doc5.jpg"/>

                <datedenaissance>
                    <jour>8</jour>
                    <mois>10</mois>
                    <annee>1985</annee>
                </datedenaissance>

                <email type="personel">meoumatma18@gmail.com</email>

                <adresse type="privee">
                    <pays>algerie</pays>
                    <wilaya>oran</wilaya>
                    <localitee>M9V5+VGC, Fernanville, Oran</localitee>
                </adresse>

            </informationpersonnel>

            <informationprofesionnel>
                <specialite>Oncologie</specialite>
                <numero categorie="mobile">0678811800</numero>
                <lieuxdetravaille>
                    <lieux type="cabinet">
                        <nom>cabinet medicale de Melianni</nom>
                        <adresse type="travaille">
                            <pays>algerie</pays>
                            <wilaya>oran</wilaya>
                            <localitee>Centre ville, Oran 31000</localitee>
                        </adresse>
                    </lieux>
                    <lieux type="etablissementdesante">
                        <nom>clinique medicale</nom>
                        <adresse type="travaille">
                            <pays>algerie</pays>
                            <wilaya>oran</wilaya>
                            <localitee>74 Boulevard Doctor Benzerdjeb, Oran 31000</localitee>
                        </adresse>
                    </lieux>
                </lieuxdetravaille>
            </informationprofesionnel>
        </medecin>
        

    </listemedecin>

     <!-- dans cette balise <listepatient> on definit tout les patient qui ont eté traitee avec un dossier medical et ont leur attribue un ID pour on puisse les réferencier dans le documment -->

    <listepatient>

        <patient idp="p_1" sexe="femme">